{"$schema":"https://json-schema.org/draft/2020-12/schema","type":"object","additionalProperties":false,"required":["schemaVersion","protocolVersion","teams","modules"],"properties":{"schemaVersion":{"const":1},"protocolVersion":{"const":1},"teams":{"type":"array","minItems":1,"uniqueItems":true,"items":{"type":"string","maxLength":96,"pattern":"^@?[A-Za-z0-9][A-Za-z0-9_.-]*(?![\\s\\S])"}},"modules":{"type":"object","minProperties":1,"additionalProperties":{"type":"object","additionalProperties":false,"required":["kind","state","activation","paths","capabilityIds","authority","owners","dependencies","workItemIds","qualification"],"properties":{"kind":{"type":"string","minLength":1},"state":{"enum":["not_started","design_ready","source_implemented"]},"activation":{"enum":["disabled","shadow","canary","authoritative","retired"]},"paths":{"type":"array","minItems":1,"uniqueItems":true,"items":{"type":"string","minLength":1}},"capabilityIds":{"type":"array","minItems":1,"uniqueItems":true,"items":{"type":"string"}},"authority":{"enum":["pure","read_only","workspace_local_write","prepared_result_only","central_state_write","external_effect"]},"owners":{"type":"array","minItems":3,"maxItems":3,"items":{"type":"string","maxLength":96,"pattern":"^@?[A-Za-z0-9][A-Za-z0-9_.-]*(?![\\s\\S])"}},"dependencies":{"type":"array","uniqueItems":true,"items":{"pattern":"^module\\.[a-z0-9-]+$"}},"workItemIds":{"type":"array","minItems":1,"uniqueItems":true,"items":{"type":"string"}},"qualification":{"enum":["design","source","hosted_installed","target_host","external_authority"]}}}}}}
