{
  "schemaVersion": 1,
  "protocolVersion": 1,
  "teams": [
    "TEAM-KERNEL",
    "TEAM-SCHEDULER",
    "TEAM-STATE",
    "TEAM-RUNTIME",
    "TEAM-WORKSPACE",
    "TEAM-PROTOCOL",
    "TEAM-AUTHOR",
    "TEAM-REVIEW",
    "TEAM-FORMAL",
    "TEAM-EMPIRICAL",
    "TEAM-NUMERICAL",
    "TEAM-BUILD",
    "TEAM-EVIDENCE",
    "TEAM-RELEASE",
    "TEAM-SRE"
  ],
  "modules": {
    "module.program-truth": {
      "kind": "pure_library",
      "state": "source_implemented",
      "activation": "disabled",
      "paths": [
        "docs/system",
        "docs/tools"
      ],
      "capabilityIds": [
        "CAP-SYS-PROGRAM-TRUTH"
      ],
      "authority": "pure",
      "owners": [
        "TEAM-KERNEL",
        "TEAM-EVIDENCE",
        "TEAM-SRE"
      ],
      "dependencies": [],
      "workItemIds": [
        "SYS-001",
        "SYS-002",
        "SYS-003",
        "SYS-004",
        "SYS-005",
        "SYS-006"
      ],
      "qualification": "source"
    },
    "module.source-qualification": {
      "kind": "trusted_in_process",
      "state": "source_implemented",
      "activation": "disabled",
      "paths": [
        "docs/rust/tools",
        "docs/rust/qualification"
      ],
      "capabilityIds": [
        "CAP-QUAL-SOURCE"
      ],
      "authority": "read_only",
      "owners": [
        "TEAM-EVIDENCE",
        "TEAM-SRE",
        "TEAM-KERNEL"
      ],
      "dependencies": [
        "module.program-truth"
      ],
      "workItemIds": [
        "GAP-GOV-003",
        "QUAL-001",
        "QUAL-002",
        "QUAL-003",
        "QUAL-004",
        "QUAL-005"
      ],
      "qualification": "source"
    },
    "module.protocol-kernel": {
      "kind": "pure_library",
      "state": "source_implemented",
      "activation": "authoritative",
      "paths": [
        "workflow-kernel",
        "paper-domain/contracts",
        "rust/crates/hepta-codex-protocol"
      ],
      "capabilityIds": [
        "CAP-PROTOCOL-CANONICAL"
      ],
      "authority": "pure",
      "owners": [
        "TEAM-PROTOCOL",
        "TEAM-KERNEL",
        "TEAM-EVIDENCE"
      ],
      "dependencies": [],
      "workItemIds": [
        "MOD-006"
      ],
      "qualification": "source"
    },
    "module.module-registry": {
      "kind": "trusted_in_process",
      "state": "source_implemented",
      "activation": "disabled",
      "paths": [
        "docs/modules",
        "rust/crates/hepta-module-platform"
      ],
      "capabilityIds": [
        "CAP-MOD-REGISTRY",
        "CAP-GOV-OWNERSHIP"
      ],
      "authority": "read_only",
      "owners": [
        "TEAM-KERNEL",
        "TEAM-PROTOCOL",
        "TEAM-EVIDENCE"
      ],
      "dependencies": [
        "module.program-truth",
        "module.protocol-kernel"
      ],
      "workItemIds": [
        "MOD-001",
        "MOD-004",
        "MOD-005",
        "MOD-007",
        "MOD-008",
        "ORG-001",
        "ORG-002",
        "ORG-003",
        "ORG-004"
      ],
      "qualification": "source"
    },
    "module.candidate-router": {
      "kind": "trusted_in_process",
      "state": "source_implemented",
      "activation": "disabled",
      "paths": [
        "docs/modules/MODULE_PROTOCOL.md",
        "docs/control-plane/COMPOSITION_ROOT.md",
        "paper-application/orchestration/candidate-router.mjs",
        "rust/crates/hepta-control-plane/src/source_closure.rs"
      ],
      "capabilityIds": [
        "CAP-MOD-CANDIDATES"
      ],
      "authority": "pure",
      "owners": [
        "TEAM-KERNEL",
        "TEAM-SCHEDULER",
        "TEAM-EVIDENCE"
      ],
      "dependencies": [
        "module.module-registry"
      ],
      "workItemIds": [
        "CTL-004",
        "MOD-002"
      ],
      "qualification": "source"
    },
    "module.scheduler-core": {
      "kind": "pure_library",
      "state": "source_implemented",
      "activation": "disabled",
      "paths": [
        "docs/control-plane/GLOBAL_OPTIMIZATION.md",
        "docs/control-plane/SCHEDULER_STATE_MACHINE.md",
        "rust/crates/hepta-control-plane"
      ],
      "capabilityIds": [
        "CAP-SCH-PLAN"
      ],
      "authority": "pure",
      "owners": [
        "TEAM-SCHEDULER",
        "TEAM-KERNEL",
        "TEAM-EVIDENCE"
      ],
      "dependencies": [
        "module.candidate-router",
        "module.resource-allocator"
      ],
      "workItemIds": [
        "SCH-001",
        "SCH-002",
        "SCH-003",
        "SCH-004",
        "SCH-005",
        "SCH-006",
        "SCH-007"
      ],
      "qualification": "source"
    },
    "module.resource-allocator": {
      "kind": "trusted_in_process",
      "state": "source_implemented",
      "activation": "authoritative",
      "paths": [
        "paper-application/automation/resource-governor.mjs",
        "docs/control-plane/RESOURCE_MODEL.md",
        "rust/crates/hepta-control-plane",
        "paper-application/automation/campaign-resource-envelope.mjs"
      ],
      "capabilityIds": [
        "CAP-RES-ALLOCATE"
      ],
      "authority": "read_only",
      "owners": [
        "TEAM-SCHEDULER",
        "TEAM-SRE",
        "TEAM-STATE"
      ],
      "dependencies": [],
      "workItemIds": [
        "RES-001",
        "RES-002",
        "RES-003",
        "RES-004",
        "RES-005",
        "RES-006",
        "RES-007"
      ],
      "qualification": "source"
    },
    "module.snapshot-builder": {
      "kind": "trusted_in_process",
      "state": "source_implemented",
      "activation": "disabled",
      "paths": [
        "paper-application/orchestration/planning-snapshot-builder.mjs",
        "paper-application/orchestration/planning-snapshot-contract.mjs",
        "paper-application/orchestration/planning-snapshot-canonical.mjs",
        "docs/control-plane/PLANNING_SNAPSHOT_BUILDER_V1.md",
        "docs/modules/schemas/planning-state-snapshot-request-v1.schema.json",
        "docs/modules/schemas/planning-snapshot-component-v1.schema.json",
        "docs/modules/schemas/planning-state-snapshot-v1.schema.json",
        "docs/modules/schemas/planning-state-snapshot-currentness-receipt-v1.schema.json",
        "docs/control-plane/COMPOSITION_ROOT.md",
        "rust/crates/hepta-control-plane/src/source_closure.rs"
      ],
      "capabilityIds": [
        "CAP-CTL-SNAPSHOT"
      ],
      "authority": "read_only",
      "owners": [
        "TEAM-KERNEL",
        "TEAM-STATE",
        "TEAM-EVIDENCE"
      ],
      "dependencies": [
        "module.module-registry",
        "module.readonly-control"
      ],
      "workItemIds": [
        "CTL-002"
      ],
      "qualification": "source"
    },
    "module.policy-engine": {
      "kind": "pure_library",
      "state": "source_implemented",
      "activation": "disabled",
      "paths": [
        "docs/control-plane/COMPOSITION_ROOT.md",
        "docs/system/INVARIANTS.md",
        "rust/crates/hepta-control-plane"
      ],
      "capabilityIds": [
        "CAP-CTL-POLICY"
      ],
      "authority": "pure",
      "owners": [
        "TEAM-KERNEL",
        "TEAM-EVIDENCE",
        "TEAM-STATE"
      ],
      "dependencies": [
        "module.snapshot-builder"
      ],
      "workItemIds": [
        "CTL-003"
      ],
      "qualification": "source"
    },
    "module.rust-control-plane-service": {
      "kind": "host_service",
      "state": "source_implemented",
      "activation": "disabled",
      "paths": [
        "docs/control-plane/COMPOSITION_ROOT.md",
        "rust/crates/hepta-paper-service",
        "docs/rust/RUNTIME_MIGRATION_IMPLEMENTATION.md"
      ],
      "capabilityIds": [
        "CAP-CTL-SNAPSHOT",
        "CAP-CTL-POLICY",
        "CAP-EXE-DISPATCH"
      ],
      "authority": "prepared_result_only",
      "owners": [
        "TEAM-KERNEL",
        "TEAM-RUNTIME",
        "TEAM-EVIDENCE"
      ],
      "dependencies": [
        "module.scheduler-core",
        "module.execution-dispatcher",
        "module.commit-sequencer"
      ],
      "workItemIds": [
        "CTL-001",
        "CTL-008"
      ],
      "qualification": "source"
    },
    "module.execution-dispatcher": {
      "kind": "trusted_in_process",
      "state": "source_implemented",
      "activation": "disabled",
      "paths": [
        "docs/control-plane/COMPOSITION_ROOT.md",
        "docs/control-plane/REPLAN_AND_RECOVERY.md",
        "rust/crates/hepta-control-plane",
        "rust/crates/hepta-codex-broker/src/codex_dispatch.rs"
      ],
      "capabilityIds": [
        "CAP-EXE-DISPATCH",
        "CAP-MOD-EXECUTION"
      ],
      "authority": "prepared_result_only",
      "owners": [
        "TEAM-RUNTIME",
        "TEAM-KERNEL",
        "TEAM-EVIDENCE"
      ],
      "dependencies": [
        "module.codex-broker",
        "module.workspace-authority"
      ],
      "workItemIds": [
        "CTL-005",
        "MOD-003"
      ],
      "qualification": "source"
    },
    "module.codex-broker": {
      "kind": "host_service",
      "state": "source_implemented",
      "activation": "disabled",
      "paths": [
        "rust/crates/hepta-codex-broker",
        "rust/crates/hepta-codex-journal",
        "rust/crates/hepta-cgroup-containment",
        "rust/crates/hepta-codex-event-stream",
        "rust/crates/hepta-codex-runtime",
        "rust/crates/hepta-codex-testkit"
      ],
      "capabilityIds": [
        "CAP-EXE-BROKER"
      ],
      "authority": "prepared_result_only",
      "owners": [
        "TEAM-RUNTIME",
        "TEAM-SRE",
        "TEAM-EVIDENCE"
      ],
      "dependencies": [
        "module.protocol-kernel"
      ],
      "workItemIds": [
        "GAP-CODEX-001",
        "GAP-HOST-001",
        "GAP-KEY-001"
      ],
      "qualification": "target_host"
    },
    "module.workspace-authority": {
      "kind": "host_service",
      "state": "source_implemented",
      "activation": "disabled",
      "paths": [
        "rust/crates/hepta-workspace",
        "docs/modules/WORKSPACE_IMPLEMENTATIONS_HANDOFF.md"
      ],
      "capabilityIds": [